Name,Prize,Uni
油井用可控封堵剂的研制和应用,3,河北科技大学
超临界 CO2 萃取废旧锂电电解液及再生,3,常州大学
高性能锂离子电池纤维的产业化制备,3,复旦大学
高性能电子线用无卤阻燃辐照交联聚烯烃电缆料,3,哈尔滨理工大学
基于微纳印刷电子的可打印纸基柔性电路与纸基生物医学检测芯片,3,哈尔滨工业大学
基于 Entrotaxis 算法的有害气体泄漏事故自主寻源地面机器人,3,中国人民解放军国防科学技术大学
一种应用于气体储存和染料吸附的二茂铁基纳米多孔材料,3,湖南科技大学
一种高效水解白酒丟糟预处理液的发明,3,贵州医科大学
基于熔融沉积的特种陶瓷真空微热压 3D 打印机及其耗材,3,长沙理工大学
新型高色纯度红光材料的研发及其在背景光源等 LED 领域的应用,3,温州大学
本质安全型一体化铅冷快堆余热排出系统,3,南华大学
基于高通量高效油水过滤膜的油水分离装置的设计,3,宁夏大学
中药废弃物热解节能装置及产物应用,3,中南林业科技大学
基于热熔性植物秸秆和玉米淀粉的新一代快递包装成套技术,3,云南大学
工业固废钛石膏资源化利用关键技术开发及应用,3,广西大学
气流床煤气化工艺中关于混合器的新型雾化喷嘴开发,3,华东理工大学
血醇分析离子液体色谱柱,3,甘肃政法学院
高安全可靠长寿化耐磨耐蚀的锅炉防护涂层,3,安徽工业大学
基于电阻突变原理的铁矿粉同化性检测新方法,3,安徽工业大学
基于锑基材料的异形高性能锂离子电池,3,西北师范大学
一种金-铂@碳纳米纤维修饰适配体传感器的制备与应用,3,海南师范大学
天然气水合物储层出砂模拟与预测技术,3,中国地质大学(武汉)
绿水青山就是金山银山——矿区生态环境三位一体治理技术研究,3,兰州资源环境职业技术学院
测定低渗油藏岩心绝验对渗透率的实验装置及实验方法,3,辽宁石油化工大学
反应环境可控的三电极原位 X 射线电解池,3,福建师范大学
高品质、耐黄变 ABS 树脂制备技术,3,长春工业大学
多领域热利用——微热管阵列技术及装置研发,3,吉林建筑大学
具有智能指示功能的隐蔽响应型荧光油墨,3,广东轻工职业技术学院
一种靶向外泌体内乳腺癌标志物 miRNA-1246 的液体活检纳米金探针,3,南方医科大学
关于一种利用建筑物布局引发气流变化加快污染物扩散的研究,3,河北大学
利用微生物高效脱除电解锰渣中氨氮及重金属的方法,3,中南民族大学
基于 GF-5 DPC 图像的大气污染物动态监测系统,3,安徽师范大学
基于 SLAM 的多功能越障侦察机器人,3,北京信息科技大学
安全高效新型海洋隔水导管研制,3,中国石油大学(北京)
可重构伸缩式机械臂的设计与构型分析,3,北京工业大学
智随小宝机器人,3,北京建筑大学
高适应性智能辅助泊车与移车平台,3,长安大学
光伏电池-制氢储能-燃料电池最大功率评估软件平台 ——老少边穷地区的清洁能源降本增效辅助决策专家,3,四川师范大学
基于卷积神经网络的智能非特定人语音鱼类分拣系统,3,陕西理工大学
汽车控制器热沉腔体 T 型接头焊接新工艺及装备,3,江苏科技大学
灵敏软体执行器及其在多场景下的应用研究,3,西南科技大学
多用途高斯发射装置,3,西京学院
车门止口面密封间隙测量系统,3,东北大学秦皇岛分校
智慧交通下共享单车立体车库,3,河北科技大学
解决含沙河流灌溉问题的水沙分离装置,3,四川大学
基于云端数据管理的智能笔式万用表,3,上海理工大学
面向输电线路异物的激光智能清除系统,3,南京理工大学
高抗干扰小分子物质微型检测器,3,青岛农业大学
基于多杆牵连的柔性升降立体停车装置,3,华东理工大学
高效蜂窝静电单元-HEPA 复合式新风系统,3,河北科技大学
轨道扣件智能装配机器人系统,3,山东交通学院
基于 C125 的方程式赛车数据采集及信息反馈系统,3,燕山大学
新型静水域智能识别追踪垃圾打捞船,3,河北工程大学
基于护罩保护的智能终端接地线夹,3,山东理工大学
悬挂式输电导线异物带电拆除装置,3,上海电力大学
颅内微创手术机器人辅助导航系统,3,天津大学
水面垃圾智能收集机器人,3,太原工业学院
组合式城市防洪装置设计,3,黑龙江大学
自适应微藻卷附式采收设备,3,东北农业大学
面向菠萝种植周期的系列辅助工具研制,3,温州大学
智能晾衣架,3,宁夏医科大学
智能蓝牙水表系统,3,湖南文理学院
便携式书画保护装置-（PAPD）,3,宁夏大学
分散型集控式多功能楼宇外墙作业设备,3,内蒙古工业大学
可更换式稳定防松螺母,3,内蒙古科技大学
基于聚光直热的多效竖管降膜太阳能海水蒸馏装置,3,内蒙古工业大学
新型双重沉沙池,3,石河子大学
基于 HIL 技术的继电保护实验平台,3,长沙理工大学
针对藏北绵羊的多功能巷道圈,3,西藏农牧学院
安心智能拐杖,3,武汉城市职业学院
基于 IR 与 TCS 的自识别采摘装置,3,广西科技大学
3D 全息投影——道路状况警示墙系统,3,湖北汽车工业学院
七自由度人机协作机械臂工作单元的研制,3,东北大学
基于机器视觉的高架草莓无损采摘机器人,3,滁州学院
太阳能吸附式低湿空气便携取水装置,3,中国科学技术大学
龙门激光雕刻机,3,仰恩大学
织物吸光发热测试仪,3,黎明职业大学
基于水声仿生探测的机器鱼,3,厦门大学
自供电可换气带双摄像头电焊面罩,3,华侨大学
智能工厂数字化设计仿真技术建设方案,3,沈阳工学院
箱形钢柱螺栓连接装置,3,北京建筑大学
古木建筑遗产 H-BIM 数字化平台,3,北京建筑大学
LifeGuard——面向溺水预警与救援的智能无人系统,3,浙江大学
用于免蒸养混凝土构件的固废纳米晶核制备与应用,3,湖北工业大学
建筑工程组合式新型铝合金模板脚手架,3,广西科技大学
移动物联背景下城市智慧停车关键技术研究及应用实践,3,重庆交通大学
篱芭樵,3,北京建筑大学
新型激光智能安防车,3,航天工程大学士官学校
针对手部康复治疗的智能跟踪导训系统,3,北京工业大学
小海——基于辅助自动驾驶的智能车载机器人,3,成都工业学院
基于 BDS 与 GPS 双层多频段有源天线的设计与实现,3,西安邮电大学
自主巡航水面垃圾智能识别与清理系统,3,西南科技大学
体感水下交互系统,3,西北工业大学
高速动车组综合检修虚拟仿真系统,3,江苏师范大学
基于 TensorFlow 与 OpenCV 的图像智能处理系统,3,河北科技大学
基于脑电控制的助障轮椅,3,陕西国防工业职业技术学院
“聚星”——高精度智慧交通定位系统,3,电子科技大学
基于双目机器视觉的测距与定位装置,3,徐州工程学院
6G 高速无线通信技术,3,电子科技大学
智能影析——基于机器学习的多模态神经影像智能分析系统,3,河北工业大学
清道夫——一款旋涡式水面垃圾清理机器人,3,西南民族大学
智能手环键盘,3,防灾科技学院
高精度彩色三维轮廓实时扫描与检测仪,3,南京理工大学
智能糖膏颗粒分析仪,3,齐鲁工业大学（山东省科学院）
自适应肌力的主动式下肢康复控制系统,3,江西财经大学
柔性纺织结构无线触控设备的技术开发,3,东华大学
新一代嵌入式手指静脉生物识别技术及装置的研究,3,天津科技大学
新型人工智能电脑鼠的研制与软件开发,3,南开大学
智能导盲伴侣,3,太原理工大学
智慧导航易购,3,太原科技大学
“全息投影+幼教”整合课程及系列创意教具产品,3,上海应用技术大学
利用近红外光技术的组织血氧监测系统,3,中北大学
基于北斗精准定位及大数据可视化的云商业地推系统研究与应用,3,湖南理工学院
基于能源自治的组网式智慧基站设计——在草原生态监测及输电线路巡检中的应用,3,内蒙古工业大学
具有校音功能的高性能电子乐谱显示器,3,郑州大学
基于视觉信息融合模型的唇语识别技术,3,贵州师范学院
基于 VR 与 MR 的跨平台协同交互技术——以实验室为例,3,贵州师范学院
基于物联网与人工智能的植物看护助手,3,西南林业大学
基于脑机接口技术的儿童专注度训练系统,3,云南大学
基于深度学习的蒙汉语音智能翻译助手,3,内蒙古大学
智能跑带,3,武汉体育学院
“互联网+扶贫”扶贫精准数据协同平台,3,梧州学院
智运——基于工业 4.0 背景下的可自主无线充电机器视觉智能运输车,3,广西大学
智能锂电池组均衡管理系统,3,三峡大学科技学院
Eudemon 应用于智能家居的基于 Deep-Learning 和 WiFi 的用户行为无源感知系统,3,大连理工大学
自适应校正式手语互译系统,3,合肥工业大学
基于人脸属性识别的智能广告新媒介,3,三亚学院
基于机器学习的小麦赤霉病智能检测装置,3,安徽大学
图片水印嵌入与提取的硬件加速系统,3,大连东软信息学院
华智监测盒——蓝牙分布式多功能安全监测系统,3,海南大学
基于 3D 人体重建与表情动画的个性化虚拟人,3,中国科学技术大学
基于激光诱导荧光技术的食用油快速无损检测系统,3,安徽理工大学
基于“风光”技术的新型智能绿色农业控制系统,3,沈阳工程学院
侨侨——对外汉语口语智能学习系统,3,华侨大学
基于人工表面等离激元的漏波天线,3,厦门大学
长距离无线电能传输系统,3,大连东软信息学院
基于脑电波控制的眨眼翻书系统,3,长春理工大学
农业科技综合服务云平台——吉农在线,3,吉林农业大学
电缆问诊医生,3,吉林工程技术师范学院
一种基于深度学习的房角图像智能分级系统,3,广东技术师范大学
基于人工智能实现声波操纵微粒的任意路径规划研究,3,天津大学
新型微悬臂梁阵列传感器系统设计及应用,3,安徽理工大学
动力学方程数值求解在辅助软件中的应用——以弹射类页游和手游先驱《弹弹堂》为例,3,东北大学
应用于 X 射线成像系统的像素化闪烁屏,3,长春理工大学
立体养鸡系统死鸡巡检装置及巡检方法,3,中国农业大学
基于磁分离及量子点 FRET 的地塞米松免疫层析试纸条,3,北京科技大学
“移动工厂”——基于农林废弃物高值化利用的移动式微波辅助解聚装置,3,陕西科技大学
新型促皮肤损伤修复蚕丝蛋白敷料的研制,3,江苏科技大学
三酶级联催化制备抗癫痫病药物中间体 L-2-氨基丁酸,3,江南大学
紫苏油-叶黄素酯速溶粉系列固体饮料,3,哈尔滨商业大学
多功能理疗护理器,3,宁夏医科大学
抗动物大肠杆菌高免卵黄抗体的研制,3,内蒙古民族大学
天麻废弃菌材在食用菌栽培中的利用开发,3,西南林业大学
一种太阳能驱动旋转栽培架,3,西藏农牧学院
基于 PWM 技术的新型便携式户外物质浓度检测仪,3,桂林电子科技大学
LPS 介导的低度慢性炎症下的非酒精性脂肪肝细胞模型,3,兰州大学
一种用于林木切枝杂交的培养装置,3,辽宁生态工程职业学院
冬茶及衍生产品的综合开发利用,3,中国科学技术大学
人乳寡糖生物酶法合成及在母乳化配方奶粉中的应用,3,福建农林大学
稻谷全籽粒高值化综合利用,3,吉林农业大学
智能化下肢康复仪,3,南京中医药大学
智能生物显微镜,3,电子科技大学
可固定皮下持续负压吸引装置,3,哈尔滨医科大学
输液激光报警器,3,宁夏医科大学
3D 打印辅助治疗 Pilon 骨折的临床研究与应用,3,温州医科大学
基于卷积神经网络的食管癌辅助诊断系统,3,桂林电子科技大学
实用硬脑膜悬吊-剪开-缝合模拟器,3,安徽医科大学
一种用于腹腔内微创手术收纳取出的通道装置,3,中国医科大学
专为听力残障人士设计的助听转换器,3,深圳信息职业技术学院
基于 Micro CT 三维重建技术构建 3D“数字牙”资源库,3,中山大学
“奶嘴式”中成药物含服器——基于“舌面脏腑、经穴分属”理论,3,成都中医药大学
艾极塔灸——融合聚能低耗结构和控温净烟系统的可移动定制型铺灸,3,河北中医学院
多功能一体化苗药生发仪,3,贵州中医药大学
小米油健康护理产品的开发,3,河南中医药大学
降糖凝胶：胰岛素无痛给药先行者,3,福州大学
“开-关”策略设计白光有机光电二极管,3,北京大学
新型碳纤维增强树脂基复合材料的关键技术与应用,3,陕西科技大学
“暖 e 家”智能环保设备及能源互联网模式的运营,3,山东科技大学
5G 手机散热用轻薄化超导热板,3,南昌航空大学
活性染色纤维素制品的光量子体系剥色技术研究,3,苏州大学
固液两相流声衰减数据反演多参数检测系统,3,河南科技大学
互穿网络亲疏水大分子结构的设计及防雾树脂的研发,3,江南大学
低成本高性能碳化硼复合抗弹陶瓷,3,南京理工大学
锂离子电池仓库热失控预警与应急处置技术研究,3,南京工业大学
煤层爆破注水一体化技术及装备,3,中国矿业大学
环境友好型高效抑制单宁扩散水性木器漆助剂,3,烟台大学
亚微米纤维膜梯度成型技术及在高效低阻空气过滤领域的应用,3,东华大学
一种具有声波响应特性的自供电深层护肤微电流面膜,3,东华大学
宽色域无镉量子点显示材料及 LED 应用,3,上海大学
新型荧光粉的研发及其在 LED 照明中的应用,3,济南大学
便携式癌症早期预警芯片的研发,3,济南大学
纤维素接枝超支化胺类蛋白吸附材料的制备及应用,3,哈尔滨工程大学
新型高性能柔性锂离子电池正极材料,3,武汉理工大学
植物染色纺纱数字化开发技术,3,嘉兴学院
光/电能源催化剂的制备及多功能能源装置的研制,3,济南大学
荷电混流云雾智能除尘系统,3,安徽理工大学
一种植物精油的小型半自动化生产装置,3,兰州大学
一种老年人关怀机器人轻量化及功能设计,3,重庆大学
绿色可循环利用光响应高分子材料的研究,3,中国科学技术大学
锂电级碳酸甲乙酯高效合成技术及工艺,3,沈阳化工大学
基于添加第四组元制备的高强度高塑性 Ni-Mn-In（Ga）基磁性形状记忆合金,3,大连大学
高效降解挥发性有机污染物的新型固体清除剂,3,吉林农业大学
室温液态金属柔性电子,3,深圳大学
醇基燃料气化采暖炉的设计,3,山西大学商务学院
固定化孢子小球联合动态反应器还原水中 Cr（VI）,3,东北林业大学
基于广西特色水果百香果的 “三态”系列深加工产品,3,广西科技大学
“感炭”椰壳生物炭型土壤改良剂,3,海南热带海洋学院
基于物联网与智能硬件的城市居民生活垃圾收运处理模式设计,3,大连海事大学
基于巴哈赛车的传动系设计分析,3,西南林业大学
溅镀高熵合金氮化薄膜提升刀具性能的研究,3,东莞职业技术学院
具有扩散功能的导光板结构优化研究,3,广东技术师范大学
人工土拱效应提高地基承载力室内模型试验研究,3,东华理工大学
粮仓建筑设计方案气密性评价系统的研究,3,河南工业大学
面向时空应用的不确定时空数据建模及预测方法的研究,3,东北大学秦皇岛分校
基于 RFID 无源感知的高精度室内定位技术研究与应用,3,南京邮电大学
极端复杂环境下的高清鬼成像技术研究,3,华东交通大学
基于增强损失函数生成对抗网络的图像超分辨率重建,3,青海大学
南方丝绸之路云南段周边典型少数民族服饰图案统计特性定量分析,3,云南警官学院
亚马逊棋机器博弈系统研究与关键技术优化,3,沈阳工业大学
高阶导模干涉刻写椭圆形亚波长纳米孔阵列理论研究,3,兰州理工大学
一种容忍三节点翻转的锁存器设计,3,安徽大学
面向受扰动的动态复值二次规划的高精度算法,3,兰州大学
基于二维过渡金属硫化物的高性能光纤传感与调制器件研究,3,暨南大学
基于血流储备分数的颈动脉狭窄智能辅助诊断方法,3,复旦大学
5d 过渡金属原子吸附的硅烯体系的电子结构和拓扑特性,3,苏州科技大学
基于电容法γ-Fe2O3 纳米掺杂液晶显示动力学响应研究,3,河北工业大学
对于有质量和力常数无序的晶格振动的辅助相干介质理论,3,上海科技大学
浑浊介质中偏振差分成像原理研究,3,中北大学
从参数解研究热力学系统的相变,3,浙江工业大学
氧化锌微米球作支架层的自供电钙钛矿光电探测器,3,湖北大学
基于多星融合反演的地表土壤含水量估算方法研究,3,桂林理工大学
利用贝塞尔光晶格和自旋轨道耦合在玻色-爱因斯坦凝聚体中制备三维孤子的新方案,3,湖北科技学院
多元金属磁性纳米岛的物性研究,3,沈阳工业大学
BiFeO3 陶瓷介电弛豫的研究——以 La/Co 掺杂为例,3,安徽大学
中国西部大气降水中稳定同位素研究进展,3,兰州城市学院
多模光纤中的光传输与变换,3,华侨大学
单晶纳米立方体形状的 MoS2-3D 石墨烯作为高容量铝离子电池正极材料,3,新乡学院
气候变暖对中国干旱区与湿润区极端降水变化的影响研究,3,东北师范大学
非线性波的新型自局域理论及其操控研究,3,佛山科学技术学院
耦合幂律电磁场黑洞的 T-S 临界特性,3,岭南师范学院
耐镉内生菌的分离鉴定及对水稻种子萌发和幼苗生长的影响,3,首都师范大学
杏仁中央核-中脑通路参与慢性痛调控的机制研究,3,空军军医大学
肽聚糖增强克氏原螯虾免疫机能的分子机制及应用研究,3,盐城师范学院
污染饲料中 HT-2 毒素对早期胚胎的毒性影响及应对策略,3,南京农业大学
上饶 4 种地标植物超低温疗法脱毒研究,3,上饶师范学院
两种植物新真菌病害的发现及其病原菌检测技术的研究,3,南京林业大学
大豆 Bowman-Birk 胰蛋白酶抑制因子的单克隆抗体制备及免疫层析试纸研制,3,河南科技大学
模式酵母细胞周期调控新基因 Cip1 的功能研究,3,河北农业大学
基于 CADD-MIP 的五类危害因子化学发光检测法,3,河北农业大学
CDKN3 基因调控区复等位基因突变对鸡生长性状的遗传效应及分子检测试剂盒的研制,3,河南农业大学
基于植物激素的玉米害虫生物防治策略,3,黑龙江大学
小型恒温动物应对季节和食物变化的产热机理研究,3,温州大学
稻瘟病菌中一种新的欧尔密类似真菌病毒特性研究及其对病毒多样性与进化的启示,3,湖南农业大学
蝉拟青霉菌丝提取物镇痛作用研究,3,贵州大学
湿地极危植物云贵水韭孢子繁殖及幼孢苗管护,3,贵州工程应用技术学院
世界遗产地梵净山区蕨类药用植物资源调查与研究,3,铜仁学院
钠盐胁迫及不同温度下 NaCl 胁迫对甜高粱种子萌发的影响,3,北方民族大学
基于蚕丝蛋白修饰的金纳米材料构建及其癌症光热治疗功能,3,浙江大学
盐生灌木西伯利亚白刺 Na+/H+逆向转运蛋白基因在提高转基因杨树耐盐性中的应用,3,内蒙古大学
燕麦耐盐内生真菌的分离与鉴定,3,内蒙古农业大学
ZnS 量子点的生物合成及对阿萨尔基亚芽孢杆菌的标记,3,塔里木大学
利用小麦 EMS 突变体挖掘叶锈抗性位点及优质种质资源创制,3,河南农业大学
高效杀虫苏云金芽胞杆菌新菌株 X023 的分离及 Cu2+增强杀虫毒力机制,3,湖南师范大学
云南两河流域烟粉虱的多样性调查及传毒效率研究,3,普洱学院
青鱼 RIG-I/MAVS/IFN 信号通路的几种调控机制,3,湖南师范大学
藏猪 H-FABP 多态性与基因表达差异分析,3,西藏农牧学院
藏马微卫星标记的开发研究,3,西藏农牧学院
LncRNA Gm2044 在生殖细胞中表达调控研究,3,蚌埠医学院
两种茶树全基因组数据的密码子偏好性比较分析,3,合肥师范学院
海马对苯并芘亚慢性胁迫的免疫、生殖响应及其分子机制,3,鲁东大学
藏药桃儿七高海拔适应机制及其循环种植栽培,3,甘肃农业大学
电化学免疫传感器对膀胱癌标志物的早期检测,3,重庆医科大学
基于 NF-κB 信号通路和内质网应激研究芸香苷抑制 LPS 诱导的小鼠乳腺炎,3,安徽农业大学
福建省香蕉枯萎病菌的分离鉴定和三代基因组测序分析,3,福建农林大学
非天然辅酶 NCD 高效转运蛋白筛选研究,3,东北电力大学
新孢子虫病小鼠动物模型的建立及临床应用,3,延边大学
癌-睾丸基因与恶性肿瘤非整倍体的关联及其功能,3,南京医科大学
褪黑素调控小胶质细胞 M1 极化对抗应激性高血压的新机制,3,复旦大学
双酚 A 替代物暴露对小鼠神经行为影响的系列研究,3,河北医科大学
食品中违禁药物金刚烷胺的免疫快速检测方法的建立,3,天津科技大学
艾司西酞普兰对阿尔茨海默病 APP/PS1/tau 转基因小鼠的神经保护作用及机制研究,3,山西医科大学
贵州苗药“杆努尽烟”对慢性支气管炎大鼠肺组织 TLR4 及 TNF-α表达的影响,3,贵州医科大学
"1,25-二羟基维生素 D3 对高原急性肺水肿预防和保护作用的研究",3,青海大学
TRIM33 调节 IDH2R172H 基因突变相关的胶质母细胞瘤分化的作用研究,3,宁夏医科大学
新疆黑蜂胶对结肠癌大鼠 T 细胞亚群调节作用的研究,3,新疆医科大学
两色金鸡菊提取物对 DN 小鼠肾脏 miR-192/200b、PTEN/AKT 和 ZEB2/ECM 通路的影响,3,新疆医科大学
3-溴丙酮酸下调己糖激酶 II 抑制肺血管重构的作用和机制研究,3,温州医科大学
生物酶介导的荧光酶联免疫吸附测定方法的构建及其应用研究,3,广西师范大学
传统中药熊果酸改善肾损伤治疗骨质疏松的新型潜在分子机制研究,3,青岛大学
磁珠偶联 ABO 血型抗体分离两男性个体混合精斑,3,中国医科大学
橙皮油素对硫代乙酰胺所致小鼠肝纤维化的保护作用及分子药理学机制,3,大连医科大学
梓醇通过下调 MicroRNA-132 激活 SIRT1 缓解结肠炎中的内质网应激,3,大连医科大学
基于 PI3K/AKT 信号通路探讨 hBMSCs 对胶质瘤的负性调控作用,3,兰州大学
骨形成蛋白-4 在角膜损伤修复中的机制研究,3,吉林大学
基于光激化学发光法筛选新型 D-二聚体单抗,3,吉林医药学院
Etk 与 PFKFB4 相互作用，通过调节自噬调节小细胞肺癌化疗耐药,3,南方医科大学
基于 SPIONs 修饰的干细胞在脉冲电磁场下浓聚迁移的能力及其促成骨分化的机制探寻骨缺损的新型治疗方法,3,南方医科大学
肺炎克雷伯菌 NDM-1 巯基丙酸抑制剂的 3D-QSAR 及其与靶点的分子识别,3,成都大学
水相 [2 + 2]环加成反应合成氧化石墨烯基β-内酰胺抗生素,3,成都中医药大学
竹节香附素 A 抗人结肠癌的药效及分子机制研究,3,南京工业大学
经典名方百合地黄汤治疗抑郁症的疗效、药理机制及物质基础研究,3,山东中医药大学
痛泻要方通过肠道菌群调节五羟色胺水平治疗腹泻型肠易激综合征作用机制的研究,3,天津中医药大学
百炼提其华，抗菌寻其根——白及联菲抗菌机理及应用研究,3,浙江中医药大学
醒脑静注射液一次提取过程质量控制方法研究,3,浙江中医药大学
基于脑心同治理论的益气活血方药（甘草红花等）抗心脑缺血的作用研究,3,浙江中医药大学
苦参碱在多重刺激响应性水凝胶薄膜传感器上的可调控电化学行为研究,3,宁夏医科大学
HTLV-II 生物传感器的构建及肿瘤早期诊断试剂盒的开发,3,河南中医药大学
基于 HIF-VEGF-ANG 轴探讨青藤碱抑制类风湿关节炎血管生成的机制,3,三峡大学科技学院
五行音乐疗法的理论体系梳理及其曲库修订汇编,3,河南中医药大学
应对耐药菌感染的药物杂合体分子的制备与活性研究,3,福州大学
透明质酸修饰载 TPCA-1 金纳米笼抗炎作用研究,3,河南工业大学
参贞扶正合剂对化疗引起的骨髓抑制小鼠造血功能的恢复影响及物质基础,3,吉林农业大学
青蒿素-异硫氰酸酯杂联体衍生物合成及其抗神经胶质瘤生物学评价,3,广州中医药大学
镓基液态金属电润湿变形机理及其应用研究,3,中国农业大学
"白磷矿型红色荧光粉 CaSr2(PO4)2: Sm3+/Eu3+,Li+的制备、晶体结构与发光性能研究",3,中国地质大学(北京)
镁基复合材料的制备及其应用,3,内江师范学院
无粘结剂非对称超电容器的构建及电化学性能研究,3,西北大学
可用于新型氢燃料电池汽车的纳米催化剂制备及其性能研究,3,四川师范大学
含 N、O 功能基的金属离子吸附剂的构建及性能研究,3,鲁东大学
脂/聚合物芯鞘结构的电纺制备与药物缓释应用研究,3,上海理工大学
高比能长寿命锡基钠离子电池负极的开发,3,同济大学
生物活性含氧含氮杂环骨架的选择性构建,3,江苏师范大学
