Name,Prize,Uni
单目多光谱三维重构技术及其在医用内窥镜中的应用,0,上海交通大学
碳纤维复合材料自加热原位固化装备,0,南京航空航天大学
基于低阻复合式气动布局的垂直起降高速飞行平台,0,北京航空航天大学
仿生太阳能无人机,0,西北工业大学
快速救灾抢险高效自循环自吸离心泵关键技术研究,0,江苏大学
高精度多维力传感器及航天员生物力学测量系统,0,东南大学
新型轮毂电机车轮设计及其整车应用,0,清华大学
超高分辨率微波光子实时成像雷达,0,南京航空航天大学
软硬件联合优化的新型低功耗 5G 通信系统,0,清华大学
Mcontroller——跨维度机器人运动控制系统,0,北京航空航天大学
高性能量子数字签名系统,0,南京邮电大学
I Know You: 基于多源异构数据的分层用户建模通用框架,0,清华大学
基于深度学习的多传感融合手势识别与控制系统,0,江西财经大学
镓基液态金属表面结构和多场调控理化性质的研究及应用,0,北京航空航天大学
三维回转模拟微重力效应在线剪切体外细胞培养系统的构建,0,北京航空航天大学
用于高效细胞捕获的基于仿病毒结构的多级微球设计,0,上海交通大学
水稻粒重基因 qPE9-1 和 OsGASR9 的功能研究,0,扬州大学
免疫检查点 PD-1/PD-L1 (PD-L2)的调控机制研究,0,南通大学
褪黑素调节肠道代谢防控大肠杆菌型脑膜炎——基于肠-脑轴微生物代谢调控的研究,0,扬州大学
多元肿瘤标志物化学发光阵列芯片检测仪,0,扬州大学
高性能、低成本燃料电池阴极催化剂的开发,0,清华大学
基于电场操控的抗消磁反铁磁存储芯片器件,0,北京航空航天大学
基于掺杂诱导相转变设计高性能锂离子电池负极材料,0,复旦大学
高效热-光协同催化水制氢的机理研究,0,上海交通大学
高性能新型锌离子电池研制与优化机制研究,0,武汉理工大学
百年风华，劳工神圣——有关“一战”华工文化记忆的调查研究,0,上海大学
建设生态文明背景下的电力行业效率改进与减排优化研究,0,北京航空航天大学
精准扶贫中的贫困识别：福利损失与解决办法 ——基于西部、东部、东北的调研与实证研究,0,清华大学
“退之有道”：兼顾农户利益与社会效益的宅基地退出模式优化研究——基于浙江省 15 个县市区调研,0,浙江工商大学
行动起来，向滥用抗生素说不！——中国 13 省市 1345 家零售药店无处方销售抗生素情况调查及应对研究,0,浙江大学
生命的馈赠——器官捐献家庭意愿影响因素与对策研究,0,温州医科大学
基于供应链金融的“三维信用评价体系”助力中小微企业融资增信——对 140 家企业和 40 家金融机构的访谈调研,0,上海大学
护航“网生代”——Web3.0 时代未成年人网络权益软性保护路径研究,0,东南大学
科学育孙万家行—祖辈教养“2+X”课程开发与推广,0,上海师范大学
网络舆情“体制归因”演化机制及防控策略研究——基于 503 个教育网络舆情案例分析,0,福建师范大学
脑电反馈智能电针灸仪,1,江苏师范大学
低温射流加工微流道技术与装置,1,南京航空航天大学
辐射约束下核电站作业路径规划：辐射场快速构建与智能寻路算法,1,华南理工大学
复杂网络分形特性分析及其应用研究,1,西北工业大学
级联拉曼混频技术及颜色可选激光研究,1,温州大学
高效中红外宽波段可调谐激光光源,1,温州大学
模拟医生操作实现人机协同的血管介入手术人工智能装置,1,清华大学
基于叶轮泵的经皮心室辅助系统(AUXART)研发,1,南京医科大学
新型多功能活性菌生物质材料：二代生物乙醇生产和污水处理,1,江西师范大学
基于微流控技术的癌症早期检测芯片,1,北京工业大学
碱基增粘水凝胶材料的制备及其性能研究,1,长春工业大学
深紫外荧光双光谱溶解性有机物快速检测技术及其应用,1,南京大学
复杂锻件高温自动化三维测量系统,1,华中科技大学
便携式太赫兹危险液体检测仪,1,上海理工大学
大行程、无回退步进式压电驱动器研制,1,吉林大学
双轴深耕匀混智能化贴地播种复式作业机,1,扬州大学
半导体发光显示器件超薄微型化制造关键技术,1,华南理工大学
一种新型高压柱塞油泵装置的设计与实现,1,浙江工业大学
变废为宝——基于进化学习机制的全自动垃圾分类回收系统,1,广州大学
面向主动靶向给药的精确可控液态金属微机器人,1,苏州大学
增材—吹胀：新型铝合金液冷板的技术研发与应用,1,宁波大学
基于自动驾驶的芝麻联合收获机,1,青岛农业大学
无臭氧、低能耗、高灭菌效率的低温等离子体消毒柜,1,西安交通大学
桥梁钢结构裂纹实时监测系统,1,同济大学
分布式肌电采集柔性电子皮肤,1,华中科技大学
基于路面激励高速高精度动态压力传感技术与 IPv6 物联网的交通信息远程监测系统,1,广西大学
微注入式配电电缆绝缘劣化“不停电”监测装置,1,华中科技大学
面向水下探测与鱼群诱集的柔体仿生鱿鱼,1,上海海洋大学
基于主-副数字微镜的光纤器件数字光刻系统,1,南昌航空大学
三维高集成度第五代移动通信射频前端,1,南京邮电大学
人工智能辅助的 OFDM 无线传输系统：设计与实现,1,东南大学
大尺度高分辨光纤声波地层成像仪,1,华中科技大学
具有划时代意义的半匝绕组平面变压器技术,1,昆明理工大学
高性能平板型量子点荧光太阳集光器设计与应用,1,宁波大学
糖尿病视网膜病变智能筛查与辅助诊断系统 DeepDR,1,上海交通大学
智能无镜显微镜,1,华中科技大学
基于人工智能的自闭症谱系障碍早期筛查,1,西安电子科技大学
基于嵌入式视觉的导盲辅具,1,华东理工大学
基于 TMC 材料的新型类脑忆阻器的设计、制备与应用,1,南京邮电大学
动态立体 LED 舞台仿真控制系统,1,北京理工大学
广义 b-方程的孤立波分支,1,华南理工大学
具有特殊传输特性的新颖自加速与旋转光束的调制研究,1,华南师范大学
Cry3Aa 分子改造及其与红棕象甲伴生菌 Ye1-8 的协同增效作用,1,福建农林大学
基于鸟类应激反应的机场鸟击防控智能装置研发与应用,1,华南农业大学
适用于骨科生物材料打印的多功能舱,1,南京航空航天大学
茶树根际微生物响应土壤酸化的代谢模式及其信号转导机制研究,1,龙岩学院
海栖类扁虫新种发现与分子系统发生分析,1,深圳大学
脑水肿的细胞内力学机制研究,1,南京中医药大学
新型生物医用微针的研究及其在疾病诊断与治疗方面的应用,1,东南大学
复合微生态制剂对经济鱼类营养与免疫机能的作用研究,1,浙江理工大学
神经病理性痛及其诱导抑郁样行为的中枢神经通路、炎症机制及治疗策略研究,1,空军军医大学
基因组水平疾病相关基因鉴定方法的开发及其在精准医学中的应用,1,深圳大学
基于能量代谢的大黄?虫丸逆转肝癌耐药机制研究,1,南京中医药大学
LncRNA 调控 MDSC 参与肺癌肿瘤免疫功能的研究,1,江苏大学
促炎症消退介质防治类风湿性关节炎的基础和临床应用研究,1,温州医科大学
面向钛基牙根种植体基于电场刺激的生物活性与可控抑菌一体化涂层,1,西安交通大学
"连续安全合成法制备火箭推进剂 1,2,4-丁三醇三硝酸酯新工艺",1,常州大学
全降解秸秆板的生物粘结成型技术开发及产品应用,1,嘉兴学院
双燃料微型燃气轮机的设计与研发,1,哈尔滨工程大学
利用 18F 衰变产生γ光子的内腔探测与成像装置,1,南京航空航天大学
铜催化的四组分串联反应合成胺芳硒基化的马来酰亚胺,1,温州医科大学
钛合金与超高分子量聚乙烯高性能连接的技术实现及其在关节假体中的应用,1,上海交通大学
低值茶高效利用智能控制及智能评价方法,1,江苏大学
仿生特殊浸润性界面用于流体传递的优化及应用,1,天津大学
巧辨抗氧化类物质的化学“鼻/舌”——基于模式识别的传感分析新方法及应用研究,1,华东师范大学
新型聚集诱导发光材料的设计合成及其力刺激发光响应研究,1,华南师范大学
Co/β-Mo2C 异质结@氮掺杂碳纳米管高效双功能电催化剂,1,广州大学
基于氟代效应的具有钙钛矿结构的分子材料极性调控,1,东南大学
阳极 TiO2 纳米管传统理论的反证据和生长机理研究,1,南京理工大学
设计立县：基于福建松溪的设计扶贫实践与模式更新,1,华东理工大学
关于“塔西佗陷阱”的研究——政治史学视野下的文本追溯与古今之辩,1,重庆大学
产业驱动的乡村振兴之路 3.0 版——对浙江省 9 镇 36 村地方产业驱动乡村发展的典型模式研究,1,同济大学
脱贫长效机制研究——基于中部三省四县的调查,1,复旦大学
制造业中小企业创新的成功之路——“协同创新+靶向服务” 的江阴经验,1,南京大学
农房共享、融通城乡：农村闲置房屋盘活利用的可行模式探索——基于陕西高陵、湖南浏阳两地三案例的调查研究,1,江西师范大学
新旧动能转换背景下传统制造业“潮涌现象”的形成与演化机制研究,1,齐鲁工业大学（山东省科学院）
信息流广告的广告相关性如何提升广告转化率的机制研究——基于有调节的中介效应模型,1,南开大学
民营经济如何迎来大发展的春天？——各省民营经济政策与落实情况研究,1,浙江工业大学
乡村振兴战略背景下中国农民的农地情怀与政策期待 ——基于 8432 位农民对家庭联产承包责任制的感知,1,华南理工大学
印度主流媒体对“一带一路”倡议的认知情感变化及原因分析,1,南通大学
“追梦人”的逐梦路：探寻大学生创客群体的发展之道,1,南京工程学院
宅基地“三权分置”改革：权能困境、农户反响和产权实现研究——以国家级试点区浏阳市为例,1,湖南工商大学
小农户也有大市场：城郊小农户农产品流通模式创新研究——基于长沙市 5 区 28 个城郊村调研,1,长沙理工大学
被遗忘的孩子：多中心协同救助模式新探索——基于浙江省 317 名“双服刑人员”子女成长困境的实证调研,1,金华职业技术学院
飘零的金达莱——延边朝鲜族村落人口外流与民俗文化传承之困,1,吉林大学
文化复兴视角下岭南乡居的价值探索与风貌重塑研究——基于对潮汕传统村落的调研,1,广东工业大学
运动作剑，弃毒前行——基于我国 7203 名青少年戒毒人员体质调查的运动干预方案设计与效果跟踪,1,华南理工大学
数据山水——基于气候适应性的京津冀传统古村落山水格局设计指导,1,北京工业大学
消除黑臭，澈水长流——基于西安市黑臭水体防治对策研究,1,西安建筑科技大学
公共服务资源供给与社区组织网络构建：以农村睦邻点为例的调查分析,1,上海大学
网络募捐信任危机化解机制研究——基于信息经济学的分析,1,山东财经大学
抢救最后的宝藏：民间文书“生存”状态的调查及对策建议,1,浙江师范大学
困境与期盼：农民幸福路在何方？——基于全国东中西部 17 个乡镇的调查,1,湖南大学
从区隔到融入：麻风村后代社会融入困境的消解——基于西南山地 15 个麻风村的实证研究,1,云南大学
长照保险化解失能老人照护风险——基于长春市长期照护保险试点实施情况调查报告,1,长春工业大学
台湾青年学生国家认同现状及影响因素调查研究——以台北高校学生为例,1,暨南大学
如何绘制新时代“富春山居图”——苏南地区村土地利用规划编制实践,1,南京大学
破局与更立：共享单车发展困境与协同治理研究——基于政府-企业-公众联动视角,1,山东师范大学
异质与归位：农民合作社嵌入乡村治理的实践检视与优化路径——基于晋、皖、沪、川的调查,1,华东师范大学
融“工笔”入“写意”，绘互联互通新丝路——中国高铁“走出去”的知识产权风险调查研究,1,华东交通大学
网约车个人信息保护问题研究,1,中南大学
来华留学生中国情怀形成机理与提升对策研究——基于对京津冀高校来华留学生的调查,1,河北经贸大学
初中生校园欺凌的精准治理模式实践探索——基于累积生态风险模型的心理干预实证研究,1,西南大学
红色基因的国家记忆——新时代抗美援朝精神的老兵诠释,1,辽东学院
何以解困：农村教育贫困的文化根源与精准扶贫——基于粤西三村的田野调查,1,华南师范大学
多光子聚合大尺寸三维纳米直写系统,2,广东工业大学
水下海生物清洗机器人,2,浙江大学
基于相位测量偏折的晶圆表面面形检测系统,2,中国计量大学
一种基于物联网技术的智能电渗防水系统研发,2,中国矿业大学
基于太阳能风能综合利用的小型淡水制取装置,2,山东大学（威海）
无人值守继电室自主巡检及远程应急操控机器人,2,浙江工业大学
高仿真测绘信息沙盘制作设备,2,闽江学院
智能坯布疵点检测器,2,东华大学
基于机器视觉技术的蔬菜健康钵苗智能识别及劣质苗剔除装置,2,河南科技大学
变工况下机械传动链智能故障分析仪,2,武汉科技大学
基于科恩达效应的无桨推进器的实验与研究,2,郑州大学
基于激光诱导荧光的室内空气微生物实时监测装置,2,南京工业大学
智能汽车个性化换道辅助系统,2,吉林大学
气流环绕型药液回收式果园风送喷雾机,2,南京农业大学
适用于零部件装配的多自由度机器臂,2,长春理工大学
基于高强度瞬变脉冲磁场的异种金属焊接技术,2,重庆大学
面向船舶分段建造的智能胎架系统研制,2,江苏科技大学
基于子母机协同的高效铁轨检修机,2,武汉理工大学
面向大型石油气管道的管内检测机器人,2,山东大学（威海）
糖尿病视网膜黄斑病变光学成像仪,2,福州大学
北斗导航倍增器,2,哈尔滨工程大学
基于迁移强化学习的全地形自适应技术——以六足机器人为例,2,南京大学
“XGZ”盒式变体无人机,2,西北工业大学
低速重载轴承在线监测系统,2,安徽工业大学
基于容错控制的四轮毂驱动全地形电动“蜘蛛车”,2,安徽工程大学
基于 EVFM 和 DSP 的核反应堆钠中气泡探测器,2,合肥工业大学
阿斯巴甜高盐有机废水高效节能绿色处理装备研发与应用,2,常州大学
飞机结构防腐涂层的老化状态监测系统,2,湖北工业大学
刀尖仿生微结构单点金刚石振动压印装置,2,杭州电子科技大学
随动式残膜回收秸秆粉碎联合作业机,2,石河子大学
星载指向机构的研制及其应用研究,2,西安交通大学
超级电容与蓄电池混合储能型的大型矿车制动能量回收与利用系统,2,武汉工程大学
混联式可移动重载铸造机器人,2,安徽理工大学
基于红外测距融合 Kalman 滤波的电车防撞预警系统设计,2,铜陵学院
基于环形开槽的宽频高效射频能量收集理论与关键技术研究,2,河南师范大学
基于行星轮的单动力双向搅拌粉喷桩机钻头,2,南昌工程学院
可续航多温区智能生鲜冷链箱,2,厦门理工学院
应用于复杂地形的无人机和无人车协作导航系统,2,东莞理工学院
可重构机器人模块及系统,2,广东工业大学
六足仿生机器人,2,长春工业大学
基于新能源和市电的双火线家庭供电系统,2,山东科技大学
速度可控且具有双缓降功能的纯机械式高层建筑应急逃生装置,2,滨州学院
多功能节能型稳定平台,2,北京理工大学
有杆抽油泵人工智能诊断控制系统,2,常州大学
构态可变六足机器人,2,北京邮电大学
带式运输水气两相智能喷雾除尘系统,2,安徽理工大学
滴灌用卧式自吸网式过滤器,2,石河子大学
地空协同全自主飞行倾转旋翼无人机,2,电子科技大学
非圆齿轮自动换向抽气机,2,中国矿业大学
绿林卫士——树木保温材料缠绕、涂白与病虫害智能识别防治一体机,2,盐城工学院
一种近远海复合式波浪能发电系统,2,武汉理工大学
基于北斗协同精密定位的智能导航嵌入式系统,2,武汉大学
万象视界——可阵列的空间立体显像仪,2,西安电子科技大学
FingerIO——基于声学原理的智能设备手势交互系统,2,深圳大学
面向数字产业生态圈的企业级应用程序接口（API）研发管理平台,2,广东工业大学
“海雀”水空两栖远程巡检平台,2,广东工业大学
无人机机场管家——基于 uwb 定位的无人机机场调度方案,2,西安电子科技大学
高铁助教——真实体感型 VR 高铁模拟驾驶器,2,西南交通大学
射波刀高精度视觉定位系统,2,湖北工业大学
多目视觉和可编程运动控制驱动的智能分拣系统,2,杭州电子科技大学
基于 THz 精密光谱的血液/尿液中同型半胱氨酸定量检测,2,上海理工大学
原子和类原子系统中三光子关联和三模压缩特性的研究,2,西安交通大学
基于深度学习的卫星图像矢量道路提取研究,2,同济大学
基于显微高光谱成像的胆管癌早期病理诊断方法研究,2,华东师范大学
界面上的光子自旋霍尔效应及其在信息处理中的应用,2,暨南大学
一种基于量子点微纳结构的 Micro-LED 显示芯片,2,南京大学
基于机器视觉的输电网智能巡检系统,2,福州大学
空中‘反黑’智能频谱监测系统,2,南京航空航天大学
彩绘文物高光谱信息留取与虚拟修复技术,2,北京建筑大学
超高通量基因测序图像实时校准系统,2,复旦大学
十二导联心电监护衣及辅助诊疗平台,2,齐鲁工业大学（山东省科学院）
蛋白质结构多域组装预测系统,2,浙江工业大学
高灵敏度高分辨率宽带微波光谱仪,2,南京理工大学
基于 GNSS 诱骗技术的反无人机系统,2,桂林电子科技大学
基因疾病检测“专家”——基于微流控芯片的全自动荧光原位杂交仪,2,武汉纺织大学
船载水炮“智慧眼”——智能目标跟踪与射击反馈系统,2,武汉科技大学
基于视频语义理解的用户行为实时分析预警系统,2,重庆邮电大学
变电站仪表智能识别系统,2,重庆邮电大学
新型电动汽车高效能量回收装置,2,重庆理工大学
“海洋环游者”环形智能 ROV,2,中国海洋大学
“一触即发”——面向人手的智能物联系统,2,哈尔滨商业大学
高精度工件尺寸测量仪,2,佛山科学技术学院
实验动物血流多功能成像仪,2,佛山科学技术学院
基于声光健康唤醒的人体红外感应闹钟,2,合肥学院
基于嵌入式平台的道路异常行为监测系统,2,四川大学
低能见度天气车辆辅助驾驶雷达显示屏,2,华东交通大学
脉冲能量可调的耦合腔式被动调 Q 黄光固体激光器,2,暨南大学
智能滑板教学系统,2,北京邮电大学
智能跟踪对抗游戏机器人,2,华南理工大学广州学院
智能姿态感知医用内窥镜,2,武汉理工大学
基于李氏不变量的完全无损 GHZ 态分析,2,福州大学
冰的两个氢键理论及其在可燃冰开采中的应用,2,山东大学（威海）
随机微分方程和随机脉冲微分方程解的存在性与相关定性理论的探究,2,湖南大学
基于相位调控的声波操控及其功能器件研究,2,江苏大学
等离子体模型约简和数值模拟——Fokker-Planck-Landau 方程奇异二次碰撞模型的近似方法,2,北京大学
鹦鹉螺如何在二叠纪-三叠纪之交大灭绝中幸存,2,中国地质大学(武汉)
智慧垃圾收集基站——沉浸式光电互补智慧垃圾收集基站系统,2,河北大学
铽镓石榴石晶体光波导的空间光隔离器,2,山东大学
氧化石墨烯对农药增效性能的研究,2,河北科技师范学院
基于表面肌肉电信号的多运动模式肩关节康复机器人,2,广州中医药大学
“智创胃来”——基于计算机辅助的胃肠道肿瘤数字智能化诊治系统,2,南方医科大学
智流易检——基于血液的稀有细胞检测智能系统,2,西安电子科技大学
基于高立体选择性酶生物合成屈昔多巴,2,重庆大学
基于界面压力和环境智能调控的老年人护理床设计与研究,2,安徽农业大学
基于虚拟现实的肢体及心理康复辅助训练系统,2,北京工业大学
“诱导再生”／“抗骨肿瘤”个性化骨移植材料,2,四川大学
3D 打印多位点肺部穿刺导板的研发与应用,2,同济大学
基于惯性测量单元(IMU)的可视化脊柱椎弓根螺钉植入导航系统,2,海军军医大学
基于荧光探针的中药及食品中二氧化硫速测套装的开发,2,上海中医药大学
新型抗茶叶病害纳米生物农药的研发,2,福建农林大学
老年人多功能洗澡椅,2,佛山科学技术学院
设施栽培无公害生产臭氧灭菌杀虫装置,2,淮阴师范学院
秸秆-玉米联产燃料乙醇和低聚木糖型 DDGS 的工艺,2,南京理工大学
EasyCheck——一种廉价快速易保存的癌症早筛传感器,2,西安交通大学
武陵山区翼手目动物的资源本底与种群保护,2,吉首大学
两种新噬菌体的发现、鉴定及应用研究,2,济南大学
防治小麦赤霉病及纹枯病新型杀菌剂的研发,2,青岛农业大学
Bt 毒素基因的表达与杀虫功能研究,2,海南师范大学
抗结直肠癌活性化合物的设计、合成与筛选,2,上海大学
单肠目扁虫新种及其系统进化分析,2,深圳大学
小麦耐逆因子 TaARR1 和 TaMIR1119 分子特征及功能研究,2,河北农业大学
云南省马铃薯品种资源鉴定及分子指纹图谱的建立,2,云南师范大学
玉米抗蚜虫候选基因(qRrm1)的功能变异位点鉴定,2,河南农业大学
“人乳化”配方奶：易消化婴幼儿乳品的脂质指纹图谱研究及配方推荐,2,宁波大学
基于分子识别的光、电化学生物传感器的制备及其应用研究,2,湖北大学
双载药生物多糖纳米粒子的制备、表征及其对肿瘤细胞抑制作用的研究,2,湖南师范大学
山羊 AT 模体结合因子 1 基因 SNP 与 InDel 挖掘及其与经济性状关联研究,2,西北农林科技大学
桑黄多糖与姜黄素对肉鸡健康养殖的增效——基于抗炎机制及降脂作用,2,福建农林大学
多肽因子等天然物质通过 NF-κB 及其上下游通路对于慢性炎性疾病的机制及潜在治疗作用研究,2,山东大学
从家蚕肥胖突变体发现新的肿瘤抑制基因,2,西南大学
总胆红素和直接胆红素荧光生物传感器的构建及在诊断试剂盒中的应用,2,安徽医科大学
基于中医归经理论的系统虚拟药理学筛选中药活性成分的研究——以结直肠癌为例,2,南京中医药大学
中药栀子炮制后抗抑郁增效机制研究,2,南京中医药大学
基于抑制 mPGES-2 活性的芒果苷在肝损伤中的作用及机制探究,2,徐州医科大学
新发 D 型流感病毒的病原学与流行病学研究,2,南京农业大学
脐带 MSC 外泌体防治 2 型糖尿病及糖尿病肾病的作用机制研究,2,江苏大学
靶向细菌细胞膜的阳离子单胍聚合物消毒剂发掘初探,2,华中农业大学
硒通过硒蛋白调控子宫平滑肌收缩作用机制探究,2,华中农业大学
葫芦素 B 诱导 EGFR 溶酶体降解抑制吉非替尼耐药的非小细胞肺癌的作用机制,2,湖北医药学院
面向毒品及爆炸物现场快速检测的比色传感阵列及人工视觉系统,2,青海大学
一种漂移式外轨导向振荡浮子波浪能发电装置,2,三亚学院
移动式农林秸秆微波快速催化热解多联产的装备研发,2,南昌大学
无下水道深度资源化厕所,2,郑州轻工业大学
离网型建筑综合能源系统协同与控制示范装置,2,东南大学
非凝固绿色浆液封堵瓦斯抽采钻孔方法及应用,2,中国矿业大学
高压临氢特种材料的研发及产品化应用,2,浙江工业大学
军民两用快速铺装混凝土材料及其关键技术,2,广东工业大学
高韧传感纤维编织结构智能海洋防护绳网,2,东华大学
基于人工智能模拟的中国海岸带土地利用对沿海生态安全的影响研究,2,华东师范大学
同步测量多个光电化学参数的新型测试技术及装置,2,佛山科学技术学院
快检猫—新型纳米电极重金属快速检测仪,2,吉林工程技术师范学院
前驱体激光原位转化技术在无粘结剂储能材料制备中的应用,2,杭州电子科技大学
纯电动汽车新型非电池储能供暖装置,2,北京建筑大学
高流动性无卤阻燃碳纤维增强 PC/ABS 复合材料的开发,2,华南理工大学
面向 5G 毫米波频段——新型高效吸波材料的研发与应用,2,浙江师范大学
原位溶解钙钛矿量子点打印技术,2,北京理工大学
化工园区废水深度净化高效催化剂的研发与应用,2,南京工业大学
基于 Li0.5La0.5TiO3 定点吸附的 H2S 超快响应及面向矿山安全的检测系统,2,郑州大学
