Name,Prize,Uni
可采集存储太阳光和人体运动能量的纳米纤维柔性可穿戴织物,2,中原工学院
智能可穿戴设备用体温发电电池,2,武汉科技大学
茶多酚中高附加值功能活性成分 EGCG 和 ECG 制备新技术,2,湖南理工学院
用于检测食源致病菌的鱼皮明胶薄膜包装材料,2,陕西科技大学
碳纤维增强碳化物气凝胶的制备及在晶硅生长炉中保温隔热效果研究,2,南京工业大学
超结构氮化碳体系的构建及其光催化性能研究,2,江苏大学
基于催化多重位点的生物质基绿色材料合成及其构效关系的研究,2,山东大学
规模化类铂非贵金属绿色电催化制氢建构与应用集成,2,中国石油大学（华东）
铁元素在催化形成碳-碳及碳-杂键中的新应用,2,南开大学
超声光催化和过硫酸盐活化三维海胆状 MoS2/C 纳米粒子加速抗生素去除,2,大连理工大学
双反应中心类芬顿体系去除水中有机污染物原理,2,广州大学
分子基铁电体的化学设计,2,南昌大学
新型四唑羧酸及其配合物的合成与抗宫颈癌活性研究,2,常熟理工学院
青藏铁路错那湖段挡沙墙气动力特性的数值模拟,2,北京林业大学
层状化合物的协同阻燃改性及其聚合物基复合材料的燃烧性能研究,2,中国地质大学(武汉)
g-C3N4-CuxO 异质结型催化剂的界面调控及其在难降解工业废水处理中的应用,2,武汉纺织大学
磁性牛粪生物炭对畜禽废水中酸碱性有机物的脱除性能和机理研究,2,华中农业大学
倍率型锂离子电池用正极材料的形貌调控、晶面设计、碳基复合及其性能研究,2,湖北大学
稳定高效新型非贵金属催化材料的制备及电解水性能研究,2,浙江大学
太阳光驱动催化纤维高效降解水体中新型污染物,2,浙江理工大学
DHA-花青素复合脂质体婴儿体外消化及其对肠道细胞作用研究,2,浙江工商大学
含苯并杂环骨架的类天然产物的创新合成及化合物库的构建,2,嘉兴学院
3-取代-2-吲哚酮类抗肿瘤候选药物绿色制备新策略的研究,2,宁波大学
安顺地戏“遗产化”过程中的真实性与记忆再造,2,中国社会科学院大学
90 后与“90 后”的党员对话——跨越七十年的信仰接力,2,南京大学
70 人，70 年：一个中国村庄的道德图景 ——基于江苏省徐州市马庄村的田野调查,2,南京师范大学
人工智能发展与劳动分工变奏——一项基于超专业化视角的研究,2,东华大学
传承 90 年红色基因—亭旁起义发生地包家村的保护研究,2,嘉兴学院
从传统到主流：客家文化视域下大学生社会主义核心价值观培育路径研究——基于闽、粤、赣客家地区高校的调查,2,龙岩学院
特殊群体的生命故事研究,2,岭南师范学院
基于刷卡大数据的北京地铁错峰票价政策有效性探究,2,北京交通大学
政府驱动的资本结构调整对企业负债水平的影响及渠道研究,2,北京外国语大学
河北省产能过剩的成因与治理：理论与实证研究,2,东北大学秦皇岛分校
政府投入与扶贫效果：多多益善，还是因地制宜？——基于四川省宜宾市 388 个贫困村的调研,2,上海财经大学
如何破解减税政策“落地难”？——基于上海市科技型小微企业的研究,2,上海理工大学
四川省农村金融改革试点效果及提升路径研究 ——以“两权”抵押和成都市农金改试验区为例,2,四川农业大学
从“排斥”到“拥抱”：互联网金融离农户究竟有多远？——基于江苏省 1849 个农户的调查研究,2,南京师范大学
财税政策对装备制造业全要素生产率的影响研究——基于山东省 16 地市 273 家企业的调查,2,山东财经大学
“海底丝绸之路”构想及实现路径——基于“21 世纪海上丝绸之路”倡议,2,山东财经大学
城乡之间——山西省城乡居民流动情况,2,山西大学
移动短视频时代下的营销新模式探讨,2,山西财经大学
打造为农服务新载体，创新协同服务新模式——基于“三位一体”综合合作的调查研究,2,温州大学
活权能否兴农：三权分置对农民收入质量的影响探究——基于豫陕宁三省的调研,2,郑州大学
返贫抑制：基于南疆深度贫困区精准脱贫与乡村振兴协同推进模式调查及效果满意度评价,2,塔里木大学
快递包装垃圾走向何方？——基于对沈阳快递包装废弃物循环再利用的调查,2,辽宁工业大学
基于三维视角的湖北省民营经济运行状况调查报告,2,中南财经政法大学
贫困退出背景下返贫脆弱性及长效遏制机制研究——基于宁德市的调查,2,福建师范大学
林农得“利”、政府得“绿”： 重点生态区位商品林赎买改革的福建实践与全国推广,2,福建师范大学
乡村振兴背景下农村土地“三权分置”改革探索——以广东省佛山市南海区为例,2,广州大学
工业机器人应用对就业的影响——基于中国企业数据的实证研究,2,暨南大学
农地确权对农村信贷市场发展影响研究——基于信息门槛维度,2,华南农业大学
祛魅与再魅：现代语境下佛教寺院的新媒体传播模式,2,中央民族大学
关怀生命终点的守护者——基于沪上舒缓医疗人员生存状况的实地调查与改善对策研究,2,北京大学
外卖食品的包装垃圾：治理之困与破局之道,2,上海交通大学
尺有所短，不可忽视——农药使用现状调查,2,东北大学秦皇岛分校
健康中国背景下农村居民健康状况评估及提升方案研究——穿越三秦大地的二十县实地调研,2,西安交通大学
孤岛之困如何解围？老年数字弱势群体的数字化生存困境调查与对策研究,2,南昌大学
农村社会源危险废物回收处置的问题与建议调研报告——以山东省为例,2,山东建筑大学
同撑生命保护伞，共筑应急防火墙——关于石家庄市人民群众对 CPR 了解程度的调查报告,2,河北医科大学
“二孩生育”的消费账：二孩政策下家庭结构变化对微观消费升级的影响研究,2,山东大学（威海）
精准扶贫大背景下的扶贫干部困境的研究——以河北省承德市为例,2,唐山师范学院
家门口的医生，离我们有多远？家庭医生签约服务模式与居民就诊行为——基于倾向得分匹配的反事实估计,2,天津医科大学
公共危机次生型网络舆情危机产生的内在逻辑——基于 40 个案例的定性比较分析方法（QCA）研究,2,中南大学
有温度的制度如何炼成：新时代再造乡土中国的制度逻辑和策略选择——来自湘北 Y 市 108 村红白理事会的经验,2,中南大学
八面破敌：我国临终关怀社会工作介入的困境与突围——基于三年 562 人次服务实践和 1040 名公众的访谈调研,2,浙江传媒学院
青河“新城”中易地搬迁牧民生活转型研究,2,新疆师范大学
如何“筑巢引凤”：城市体验对大学生就业地域偏好的影响研究——以对武汉市 1445 个大学生的调查为例,2,华中农业大学
指尖公益如何让人放心爱？——基于芜湖市居民对轻松筹的认知和使用情况调查,2,安徽财经大学
非遗抢救后的生存现状及市场激活策略调研——以开封朱仙镇木版年画为例,2,中原工学院
“乡村政治人”的成长与基层民主选举质量的提升——一个选举观察员的视角,2,安徽大学
惠台政策视角下台湾青年赴大陆就业创业路径研究——基于闽台两地的调查,2,福建师范大学
关不掉抖音，究竟是谁的错？——短视频视阈下网络新生代群体文化堕落现状的探究,2,厦门大学嘉庚学院
社会转型背景下关于手工技艺类非遗自我可持续性保护的研究——以佛山剪纸为例,2,南方医科大学
"申遗十年喜共忧,同寻粤剧源与流——粤港澳大湾区视野下的粤剧传承与传播",2,广东技术师范大学
未雨绸缪，科学救援——首都危险化学品事故应急物资储备优化研究,2,北京石油化工学院
清洁能源利用的抉择：北京市农村煤改电与煤改气政策实施的调查研究——以北京市通州区、丰台区、昌平区为例,2,华北电力大学
陕西农村生活源水污染物产排现状及防控对策调研——基于 3 市 9 镇 18 行政村 3 季实地调查及采样分析,2,西安工程大学
无声大爱续写“生命之约”：纪念方式和后续服务对民众遗体、器官捐献意愿的影响——基于南京市的调查,2,南京医科大学
尊严的分娩:医护人员和孕妇视角下分娩镇痛开展的影响因素与规范化路径探索,2,四川大学
抢救与呼唤：国家级非物质文化遗产——中国夏布影像记录及现状调研,2,四川农业大学
推广普通话在扶智脱贫中的“造血”路径研究——基于贵州喀斯特山区打召苗村推普脱贫的调研,2,江苏师范大学
微咸水规模化利用问题及对策建议研究——以河北邯郸为例,2,河北科技大学
乡村振兴战略下农村“天价彩礼”乱象及其治理——基于赣中南农村地区彩礼乱象的调查,2,江西财经大学
乡村振兴与农业机械化水平相关性调研,2,青岛农业大学
传好中国文化：阳明文化对西传播的实践探索——基于《传习录》海外传播比较研究后的优化升级,2,宁波大学
找行长不如找村长?——基于浙江省 5 县 9 村农村金融自治推动乡村振兴的调查研究,2,浙江工商大学
打破“边缘”幕墙，从“心”融入泉城——新时代背景下济南市新市民群体城市融入现状和对策研究,2,济南大学
静默夕阳：农村“空心化”背景下老人自杀现象及应对策略研究,2,上海师范大学
悔捐之殇：破解非亲缘造血干细胞捐献困境的理论探索与实践,2,温州医科大学
“流”大于“留”：内地三四线城市人才争夺的现实难题——基于大学生就业创业视角的分析,2,湘潭大学
“何以为家”：云南边境地区离散边民回迁调查研究——以怒江傈僳族自治州为例,2,云南师范大学
跨世纪的文物抢救：三峡文物保护工程的回顾与反思 ——基于对全国百位三峡文物保护工作者的调研访谈,2,武汉大学
面向“长江大保护”战略的城市生活垃圾分类回收问题及优化研究——来自长三角地区的多维度调查,2,安徽工业大学
制度变迁中的上下联动——基于晋江三村集体产权制度改革的实证研究,2,厦门大学
追梦、筑梦、圆梦祖国大陆：惠台 31 条对台湾青年的吸引力研究——基于 18—29 岁台湾青年的群体调查,2,华侨大学
粤港澳大湾区跨境空间的形成及其影响因素研究——以深圳市蛇口片区为例,2,华南师范大学
文化保育视野中的“老城市新活力”研究——以广州新河浦为例,2,广东外语外贸大学
青年慢性病患者的社会关系困境及介入策略——以炎症性肠病患者为例,2,中山大学
突发环境事件发生后，何以取得民众信任支持？——基于情绪识别的舆情分阶段动态应对策略,2,中国石油大学（华东）
区域特色农产品“一村一品”抱团品牌运营提升路径研究 ——基于原赣南苏区脱贫攻坚实践状况 4535 份问卷调查,2,江西科技学院
一业荣枯到水陆两栖：武家嘴 70 年乡村振兴的产业共同体模式调研,2,南京信息工程大学
全域旅游视角下厕所革命的现状、困境及对策——实证研究四川 28 个国家全域旅游示范区创建单位,2,成都信息工程大学
“谈化色变”？化工园区周边居民风险感知及其抵制行为倾向——基于 3499 个样本的实证分析,2,华东理工大学
共享配送：农村快递物流“痛点”的破解之道,2,南昌航空大学
解构负空间，重塑富空间——以贵阳市老城区为例研究城市地下通道的综合效用提升,2,贵州大学
广西北部湾红树林里的金鸭蛋：“生态养殖”还是“生态陷阱”？,2,广西大学
国家公园跨界协同保护模式研究 ——基于钱江源国家公园的案例,2,上海师范大学
城市生活垃圾分类与智能创新结合研究——以厦门为例,2,集美大学
治水“政令堰塞湖”？——河长制在基层运行的困顿及反思,2,华南师范大学
农村“垫资—第三方评估—划拨”精准扶贫模式及其绩效研究——以中部 S 县 7422 户贫困户“六改一增”为例,2,广东财经大学
在线餐饮外卖如何“利民”又“利国”--广州外卖行业引发的社会问题调查及管理对策研究,2,广东技术师范大学
如何分好“土地蛋糕”——基于北京等八试点集体土地入市增值收益分配机制改革的实地调研,2,苏州大学
绿色建筑的立法构建,2,河北地质大学
“三资”“三权”“三变”：农村土地经营权入股问题调研,2,烟台大学
“携号转网”政策下的电信运营商纵向一体化问题——以“腾讯王卡”为例,2,浙江理工大学
法律赋能新时代大学生创新创业——基于广东大学生双创现状的实证分析与对策研究,2,广东技术师范大学
基于核心素养理念的小学生非遗课程设计——以灵川团扇为例,2,对外经济贸易大学
博弈与合作：大学生合作行为形成及动力机制研究--基于西南地区高校学生的调查,2,电子科技大学
“扶贫扶智”背景下失依儿童 教育帮扶模式探索——基于四川省凉山州的实地调研,2,四川大学
流动的保障链：贫困流动家庭学前教育扶助机制研究——基于燕山-太行山地区的实地调查,2,华北电力大学(保定)
音乐治疗对视障儿童盲态纠正的干预及意义研究,2,聊城大学
依托地方历史资源的儿童绘本创作与实践研究——以上海为例,2,上海师范大学
幼“师”：学前教育教师的地位困境及提升策略——基于对上海 2200 名学前教育教师的实证研究,2,华东师范大学
大学生网络社区表达及互动研究——基于华中地区某高校 QQ 群五年的实证调查（2014——2019）,2,华中师范大学
从疏离到融入-贫困地区留守儿童亲社会性问题的调研与干预,2,武汉大学
创客教育对初中生核心素养发展影响的实证研究,2,西南大学
共沐文博阳光，同受历史洗礼——以短期支教为载体的博物馆教育模式探索,2,广州大学
基于岗位胜任力的临床医生成长质量全程追踪评价体系,2,汕头大学
香菇接种自动化设备研发,3,南阳理工学院
自动化筒节类工件焊缝 X 射线检测拍片装置及关键技术研究,3,上海电机学院
异构群智机器人空间协同搭建技术,3,西北工业大学
船舶螺旋桨水下清洗系统,3,江苏科技大学
全数字化枪刺簇绒智能织毯机,3,潍坊职业学院
全自动苹果套网套装箱生产线,3,烟台大学
氮气膨胀深冷石化行业 VOCs 废气资源化回收装置及关键设备,3,南京工业大学
基于电力电子变压器的世界首套贯通式牵引供电系统,3,西南交通大学
基于行进阻流机构的气密增强型负压式爬壁机器人平台,3,河北工业大学
横流风幕发生装置与软密封控尘系统,3,中国矿业大学
基于空化射流技术的智能化船舶附着生物清理机器人,3,河北工业大学
基于仿生缠绕效应的大承载软体抓持装置,3,燕山大学
高频磁芯损耗测量及数据自动分析系统,3,南京邮电大学
智能籽棉残留地膜检测与分拣系统,3,南京林业大学
一组六株同步蔬菜自动嫁接机,3,青岛农业大学
智能化节能型茶叶红外杀青机,3,江西农业大学
一种基于多系统整合的智能物料搬运机器人,3,燕山大学
全向移动多自由度射击靶,3,山东科技大学
航空发动机叶片超声滚压强化技术及装备,3,华东理工大学
铁轨卫士：智能铁路轨道润滑系统,3,山东师范大学
地铁隧道截面圆心确定装置制作,3,石家庄铁道大学
马铃薯多级自适应定位、芽眼自助识别智能切块制种设备,3,青岛理工大学
一种多波长偏振激光雷达新型雾霾观测系统,3,南阳师范学院
基于射流清洗、琴键作业的大型明渠“绿色清道夫”,3,华北水利水电大学
两栖越障陆空智能车,3,中国民航大学
新型智能化原位海底观测系统,3,天津大学
电网故障智能监测工程师,3,河南师范大学
基于 RGV 的柔性垂直循环式环形横移电梯运输系统,3,山东建筑大学
自重构空间细胞机器人对接单元模块设计,3,哈尔滨理工大学
基于手势体感和脑电波控制的仿生机械臂,3,运城学院
模块化外肢体机器人,3,哈尔滨工业大学
“Manti”无人机降落伞,3,黑龙江工程学院
基于卷积神经网络的高适应性智能靶喷除草系统,3,东北农业大学
搭载无伤供苗系统的全自动旱地零速移栽机,3,东北农业大学
“广目天瞳”全景影像智能态势感知系统,3,中国人民解放军国防科学技术大学
双阀电液激振的辅助加工装置及拉削应用,3,杭州电子科技大学
基于 5G 通信的高速铁路网电能调控系统——构建新一代高铁安全运行智能体系,3,湖南大学
智慧建筑室内舒适度动态监测技术及应用,3,湖南城市学院
无人机嵌入式高压电线巡检机器人设计,3,浙江理工大学
新一代多层无避让式立体车库,3,贵州大学
鸡枞锥形削根及品质分选机器人,3,中国计量大学
森林消防机器人,3,昆明理工大学
包覆式机械外骨骼,3,云南大学
智能石榴脱籽机,3,新疆工程学院
多功能电流体动力学柔性电子微图案喷印设备,3,嘉兴学院
基于九宫格和物联网系统的立体式智能车库,3,武汉轻工大学
微波法籽棉回潮率测量仪,3,塔里木大学
基于射频雷达的高炉出铁智能监测装置,3,内蒙古科技大学
一种高通量单晶自动化生长装置,3,曲靖师范学院
无形之尺——基于超声相控阵的船舶计重,3,中国计量大学
热锻模具多自由度随形增材修复系统,3,武汉理工大学
云-边协同的复杂装备智能运维服务平台技术,3,合肥工业大学
发电锅炉 CO 在线监测仪器开发与应用,3,安徽工业大学
欠驱动机械手,3,沈阳工学院
飞秒激光多目标表面形貌测量系统,3,合肥工业大学
基于双能 X 射线的煤矸智能光电分选设备,3,安徽理工大学
智能化物流终端处理系统,3,安徽信息工程学院
基于 ECO 运动目标跟踪的 UAV/UGV 协作系统设计,3,沈阳航空航天大学
高性能转子结构变速恒频风力发电机,3,沈阳工程学院
新型可变布局农用物流无人机,3,郑州航空工业管理学院
仿生四足机器人,3,大连理工大学
带送丝机构新型窄间隙 TIG 焊枪研制,3,沈阳工学院
小型同步感应线圈炮,3,中国人民解放军陆军勤务学院
汽车全空心 EPS 转向轴精密旋锻工艺,3,重庆理工大学
具有磁控粘附功能的仿生双足爬壁机器人,3,重庆邮电大学
基于深度学习的多模态人车交互系统,3,重庆邮电大学
适用于复杂地形勘测的六足式机器人,3,华北水利水电大学
双转子垂直轴风机,3,大连理工大学
床椅一体化助老机器人,3,北华大学
基于石墨烯薄膜的心血管老化血氧监测仪,3,深圳大学
基于神经网络的植保无人机变量喷雾系统设计,3,华南农业大学
面向柔性制造的新型自动锁螺丝机,3,五邑大学
模块化蛇形机器人机电设计与智能控制,3,南开大学
基于试验研究及数值分析的新型三角形截面高效耗能支撑的研发,3,长安大学
碳纤维（钢板）改性速生杨木,3,山东建筑大学
隧隧平安——隧道智能保温系统,3,淮阴工学院
海参捕捞装置,3,哈尔滨工程大学
基于深度学习的疲劳驾驶预警系统,3,浙江师范大学
地铁振动与噪声在线监测系统的开发与应用,3,上海工程技术大学
基于自发漏磁(SMFL)的无损感知爬索机器人,3,重庆交通大学
现代有轨电车槽型轨几何参数动态检测小车研制,3,暨南大学
轮足机器人自主感知与决策控制,3,北京理工大学
工业级高精度可见光室内定位终端,3,北京科技大学
繁星数据平台——基于区块链的分布式数据交易平台,3,西安电子科技大学
基于多传感器反馈的高精度可移动工业机器人打磨多用途平台,3,西北工业大学
基于紫外辐射的强激光焦点位置测量仪,3,西安理工大学
DRR Aider——视网膜病变筛查系统,3,西南民族大学
基于两栖无人航行器的青少年溺水预防和救助系统,3,江苏科技大学
基于智能图像镶嵌技术的铁路货运站高清图像货检系统,3,东华理工大学
20 Hz ~ 10 MHz 智能元件参数分析仪的研制,3,常州大学
大量程纳米级灵敏度位移测量仪,3,东北大学秦皇岛分校
高功率 GaAs 光导开关及触发技术,3,西南科技大学
基于医学图像的肿瘤分割系统,3,成都大学
船用复杂结构件智能焊接系统,3,南通大学
基于光声光谱技术的多组分痕量气体光纤传感器,3,聊城大学
基于 FPGA 的网络安全基础协议硬件实现与设备开发,3,华东师范大学
化学需氧量光学原位传感器及在线监测仪,3,燕山大学
齿轮传动设计共享 APPS,3,河南科技大学
基于改进慢特征分析的工业离变焦图像序列特征提取算法与装置,3,河北民族师范学院
全地形模块化智能救援机器人,3,上海科技大学
幻视——多功能智能导盲机器人,3,天津理工大学
基于极地极端复杂条件下海冰两栖无人机及其综合监测平台系统应用,3,太原理工大学
一种基于云平台算法的温室智能设施种植技术,3,黑龙江大学
“网安精灵”——无线网安全飞行检测器,3,黑龙江大学
高分辨三维海底成像装置,3,哈尔滨工程大学
基于 CPG 控制网络的仿生四足机器人,3,哈尔滨工业大学
生物信息遥操作人机交互系统及应用,3,杭州电子科技大学
基于双光谱技术的便携式高通量农残仪,3,中国计量大学
基于低频漏磁技术的铁磁性承压设备无损检测系统,3,中国计量大学
基于移动终端的便携式稻田飞虱智能预警系统,3,浙江理工大学
废旧电池智能收集与全过程管理服务平台,3,浙江工商大学
多旋翼无人机空气检测系统设计与改进,3,内蒙古机电职业技术学院
无线局域网络中基于安全态势感知的警报平台,3,中国人民解放军国防科学技术大学
前列腺增生双极电切手术 AI 预警及远程专家指导系统,3,武汉大学
慧眼?守护者——长江航道智能监测系统,3,湖北工业大学
小型化 RTK 北斗形变监测系统,3,桂林电子科技大学
遥感卫星智能任务规划关键技术及系统,3,合肥工业大学
双目识别双控投弹教学机器人,3,沈阳理工大学
基于三维立体矩阵模型的构建——中药饮片智能化药柜的设计与实现,3,安徽中医药大学
基于北斗导航与热成像技术的病虫害防控机器人,3,海南大学
基于商用 WLAN 和 MEMS 的室内融合定位系统,3,重庆邮电大学
“美丽出行”城市畅通服务平台的研发,3,福建工程学院
小型化全光纤中红外激光器,3,厦门大学
基于 TDoA 的麦克风阵列声源定位系统,3,大连理工大学
基于 DT/AR 的智能产线同步监控与虚拟指导技术及应用,3,上海大学
乙烯裂解炉炉管外表面非接触式智能测温仪,3,广东石油化工学院
基于视觉惯性和激光 SLAM 导航的 AGV 系统研究与开发,3,广州大学
用于活体细胞内医学检测的双光子荧光探针设计及性能提升研究,3,山东师范大学
煤层底板隐蔽水危险源效应及定位技术实验研究,3,华北科技学院
猪用抗炎止泻改性腐植酸钠的研发,3,齐鲁工业大学（山东省科学院）
利用地沟油和秸秆在嗜盐菌中合成可降解生物地膜——实现碳的零排放,3,东北林业大学
基于近红外漫射光技术的医用血流成像仪,3,中北大学
利用酶联免疫法快速筛选高甘油三酯血症致病关键因子的研究及应用,3,中南大学
基于 GSM 的仿生农药喷洒机器人,3,兰州理工大学
仿生智能酱腌菜品质检测装备,3,长江师范学院
阿尔兹海默病脑控治疗平台,3,北京理工大学
基于空间定位及超声图像引导的肌肉穿刺仪,3,哈尔滨工程大学
可携带式紧急输血救治一体化设备,3,杭州电子科技大学
人类急性髓系白血病相关核酸甲基化检测试剂盒,3,武汉大学
胆石病智能诊断平台,3,中国石油大学（华东）
基于 OMEDT（口腔医学技师操作技能水平认证考试）的口腔医学技术操作技能教考系统,3,重庆医科大学
急救用抗菌止血微球研究及产业化,3,北京理工大学
循环环保、变废为宝—基于废弃秸秆液化资源化的可持续生物沥青,3,长安大学
高等级沥青路面用蔗渣纤维开发及应用研究,3,长安大学
双环氧季铵盐与胶原多肽合成绿色多功能皮革复鞣剂,3,齐鲁工业大学（山东省科学院）
基于混合电容去离子技术的海水淡化智能装置,3,江苏科技大学
面向光子学芯片应用的有机微纳晶体光子学器件研制,3,苏州大学
低成本制备大面积电致变色玻璃,3,东北大学秦皇岛分校
基于跨海桥墩的双向波流能发电、消波和防撞一体化装置,3,西南交通大学
